{
  "title": "我要送快递可是你非要我做董事长",
  "genre": "都市轻喜剧爽文",
  "reader_promise": "一个只想准时送完快递的普通青年，被迫卷进集团董事会，用一线经验和朴素判断反杀精英内斗，完成身份错位带来的爽感和喜剧感。",
  "core_hook": "主角越想证明自己只是快递员，外界越发现他比那些董事更懂公司真正的命脉。",
  "protagonist_seed": {
    "name_placeholder": "林舟",
    "surface_goal": "每天准时送完快递，攒钱开一家自己的社区驿站。",
    "deep_desire": "靠自己的劳动过安稳日子，不再被所谓的大人物摆布。",
    "contradiction": "他极度抗拒权力，却拥有最适合修复集团底层系统的经验和判断力。"
  },
  "main_conflict": "恒远集团陷入董事会夺权和物流系统崩盘的双重危机，林舟因一份旧继承协议和一次送错会议室，被推上代理董事长的位置。",
  "tone": "轻松、反套路、节奏快、带职场讽刺和底层智慧的爽感。",
  "stage_ending": "20 章结束时，林舟不再逃避董事长身份，决定用快递员视角重建恒远集团第一条业务规则。",
  "long_form_potential": "后续可以扩展为集团改革、商业竞争、家族旧案、城市物流网络、资本局中局等长线剧情。",
  "forbidden": [
    "不要把主角写成天生霸总",
    "不要让商业问题靠一句话无脑解决",
    "不要频繁使用隐藏身份打脸的重复套路",
    "不要让女主只承担花瓶或解释工具功能"
  ]
}
