{
  "title": "我要送快递可是你非要我做董事长",
  "genre": "都市轻喜剧爽文",
  "reader_promise": "标题直接承诺“底层快递员被硬拽进董事长位置”的强反差爽感：主角不懂高层黑话却懂真实市场，不靠天生霸总气场，而靠跑单积累的人情、地气和执行力，把一群会做PPT不会送成一单货的高管按在现实里摩擦。读者期待的是反套路上位、职场讽刺、草根智慧打脸、以及主角嘴上只想送快递、结果一步步把烂摊子公司救活的连续性爽点。",
  "core_hook": "一个只想安稳送快递赚钱还债的普通骑手，因为意外卷入一家濒临崩盘的同城物流公司权斗，被创始人指定为临时董事长。董事会、资本方、职业经理人都把他当笑话和挡箭牌，想让他背锅出局；可他比谁都懂一线配送、客户脾气和系统漏洞，于是他用送快递的底层逻辑反向管理公司，在二十章内完成“从替罪羊到真正掌舵人”的阶段逆袭。",
  "protagonist_seed": {
    "name_placeholder": "陆川",
    "surface_goal": "保住快递员工作，多赚提成，尽快还清家里旧债，不被卷进大公司的破事里。",
    "deep_desire": "被人当成有分量的人，而不是随时可以替换、被训斥、被克扣的底层劳动力；他真正想证明的是，自己这种人也配决定规则，而不只是被规则压着跑。",
    "contradiction": "他口口声声嫌麻烦、讨厌开会、只信送达率和现金流，想逃离权力中心；可他又极其见不得外行瞎指挥、见不得一线兄弟被高层甩锅，一旦看到不合理的系统伤人，他就会忍不住下场改规则。"
  },
  "main_conflict": "外部冲突来自三重夹击：第一，公司创始人突发事故后留下模糊授权，把主角推上临时董事长位置，实则是想用一个最了解末端履约的人去堵住公司最危险的漏洞；第二，董事会和投资方急着甩锅，希望主角顶雷背下亏损、延误、赔偿和舆论危机；第三，竞争对手趁机挖站点、抢商户、制造舆情，试图压垮这家物流公司。主角必须在完全不具备霸总资历的情况下，用有限资源解决站点罢工、系统调度失灵、加盟商串联、客户流失和内部权力斗争等具体问题。商业问题不能靠一句话解决，每一步都要靠跑现场、拆流程、拉人心、算成本、做取舍来推进。",
  "tone": "轻松、反套路、节奏快，以都市职场荒诞感和底层观察为主要趣味来源。高管黑话、形式主义流程、资本包装与一线现实形成持续反差；主角说人话、做实事、用朴素但有效的方法解决复杂问题，形成带讽刺感的爽文节奏。同时保留人物困境的真实重量，让笑点建立在现实职场逻辑之上。",
  "stage_ending": "二十章的阶段性胜利可落在：主角通过亲自跑站点、重做奖惩、修复调度、稳住核心骑手和商户、公开拆穿某位高管与竞争对手里应外合的证据，成功止住公司最致命的履约崩盘和舆论雪崩，保住董事长位置，并让原本把他当吉祥物的董事会不得不承认他有实际掌舵能力。故事在此完成一个中篇闭环：他不再只是“被迫坐上去的人”，而是第一次主动决定留下来，把这家公司改成真正对一线人有利的公司。",
  "long_form_potential": "扩成长篇时，可继续展开更大的主线空间：创始人当初为何指定一个快递员接盘，背后是否涉及公司原始路线之争；资本方是否从一开始就想把末端运力拆卖套利；竞争对手只是商业对抗还是与内部旧势力勾连；主角如何从救火型管理者成长为能建立新规则的新一代企业掌舵人；以及他能否把“尊重一线效率与劳动者”的朴素经验，升级为可复制的商业体系。后续还能延展区域扩张、社区零售、即时配送大战、平台算法压榨、加盟体系改革等更广阔的都市商业战场。",
  "forbidden": [
    "不要把主角写成天生霸总",
    "不要让商业问题靠一句话无脑解决"
  ]
}